Title,Excerpt,Category
"Nigeria: INTELS Responds to FG, Says Process of Awarding Pilotage Contract Not Closed","The battle to retain its service boat contract in the pilotage district of Lagos, Warri, Bonny, Port-Harcourt and Calabar, which",business
"Suez Blockage Holding Up $9.6bn of Goods Daily, Stranded Ship Could Take Weeks to Remove",The stranded Ever Given mega-container ship in the Suez Canal is holding up an estimated $9.6bn (£7bn) of goods each,business
"Dangote Refinery Lekki 80% Ready, Targets Marketing Petroleum Products By 2021","Dangote Group has announced that refined petroleum products from its 650,000 per day refinery under construction will hit the market",business
Chelsea Director Marina Granovskaia Exits After Todd Boehly Takeover,"Chelsea director Marina Granovskaia has left the club, it was announced on Wednesday. Granovskaia follows chairman Bruce Buck in leaving",sports
Jeff Bezos Reclaims Title of World's Richest Person from Elon Musk,"Jeff Bezos has reclaimed his title of world's richest person, ending Elon Musk's roughly six-week reign on top of the",business
"Fleeing Sanctions, Russian Oligarchs Seek Safe Ports for Superyachts","The massive superyacht Dilbar stretches one-and-a-half football fields in length, about as long as a World War I dreadnought. It",business
"Nigeria 'Doomed' If APC or PDP Wins Next Presidential Election, 'Third Force' Advocate Nwosu Says","Nigeria will be ""doomed"" in 2023 if any of the country's politicians from the two main political parties succeed in",politics
You're Playing With Fire': Rivers Governor Wike Warns FIRS Against Sabotage of Administering Tax Laws,"Rivers State Governor, Nyesom Wike has sternly warned the Federal Inland Revenue Service (FIRS) against sabotaging and undermining the state",business
"Pfizer Covid Vaccine Effectiveness Drops after Six months, Study Shows",The effectiveness of the Pfizer Inc/BioNTech SE vaccine in preventing infection by the coronavirus dropped to 47% from 88% six,health
Britney Spears' Father Files to End Court Conservatorship,Britney Spears' father filed Tuesday to end the court conservatorship that has controlled the singer's life and money for 13,entertainment
Man City Unveil Sergio Aguero Statue to Celebrate 10th Anniversary of First Premier League Title,Manchester City legend Sergio Aguero says the new statue of him to mark the 10th anniversary of the club's first,sports
Chevron Nigeria Set to Lay Off 25% of Workforce,"Oil giant, Chevron Nigeria Limited (CNL), operator of the joint venture between the Nigerian National Petroleum Corporation (NNPC) and CNL",business
Juventus End Milan's Unbeaten Run,Federico Chiesa scored twice as champions Juventus produced a superb display to end AC Milan's unbeaten league run this season.,sports
"Dortmund's Hopes of Haaland Stay, Champions League Football Hit With Loss Against Frankfurt",Borussia Dortmund's hopes of holding on to in-demand striker Erling Haaland by qualifying for next season's Champions League were dealt,sports
AFCON: Sadio Mane Inspires Senegal to Impressive Win in Dakar,Liverpool's Sadio Mane was the highlight of the opening day of Match-day three of the 2022 AFCON qualifiers on Wednesday,sports
Zuma's Corruption Trial on Tuesday† 'to Be Postponed' Due to Ill Health,The Jacob Zuma Foundation says Tuesday's planned hearing relating to the corruption trial of former South African President Jacob Zuma,politics
"Petroleum Act Will Enhance Nigeria's Energy Growth, Deputy Oil Minister Sylva Reiterates","Minister of State for Petroleum Resources, Chief Timipre Sylva, has restated that the Petroleum Industry Act (PIA) will enhance energy",business
"Nigeria to Spend $5bn to Wipe Out Malaria, Health Minister Ehanire Says","Nigeria's Minister of Health, Dr. Osagie Ehanire has disclosed that the federal government would spend N1.89 trillion (about $5bn) to",health
Family of James Brown Settles 15-year Battle Over His Estate,"The family of entertainer James Brown has reached a settlement ending a 15-year battle over the late singer's estate, an",entertainment
Clarke Resigns as England FA Chairman after Apologising for Saying 'Coloured Footballers',"Greg Clarke has resigned as FA chairman in the wake of referring to BAME footballers as ""coloured"" while giving evidence",sports
"Some Vaccine Doses Kept Too Cold, Pfizer Having Manufacturing Issues, US Officials Say",The first days of Pfizer Inc's Covid-19 vaccine rollout have seen unexpected hitches including some vaccines being stored at excessively,health
Dollar Crisis: Nigeria Rated Most Crypto-Obsessed Nation in the World,"While the government has had a tough stance against cryptocurrencies since banning them in 2021, adoption continues to grow.Read more",business
"Presidential Primary: Southern PDP Governors Ganged Up Against Me, Wike Alleges","Rivers State Governor Nyesom Wike on Monday accused his southern colleagues of masterminding his failure to win the ticket, saying",politics
"Nigeria: Atiku Woos Lagos PDP Delegates Ahead of Party Primary, Charges Leaders to Restore National Unity","Following his recent declaration to contest for the president of Nigeria in the 2023 elections, former vice-president Atiku Abubakar met",politics
Djokovic Tells Court He Was Cleared to Enter Australia after Covid Infection,"Tennis world number one Novak Djokovic mounted his legal challenge on Saturday to being refused entry to Australia, saying he",sports
Elon Musk Laughs Off Twitter Lawsuit Threat,Elon Musk's silence over his attempt to bail out on purchasing Twitter for $44 billion is no more.Read more,tech
Lionel Messi Becomes Free Agent after Barcelona Contract Expires,"Lionel Messi's contract with Barcelona has expired, leaving the 34-year-old as a free agent. Messi is currently playing in Copa",sports
Nigeria Pays $100m for Siemens Power Project,Nigeria's federal government has made a payment of $100 million as part of Nigeria's counterpart fund in the Presidential Power,business
Nigeria: PDP Governors Want Parliament to Quickly Rework Electoral Bill and Return for Assent,"Governors elected on the platform of the main Peoples Democratic Party (PDP), on Monday, urged the National Assembly to rework",politics
Shakhtar Donetsk 2-0 Real Madrid: 13-time Champions at Risk of Group Stage Elimination,Real Madrid are in danger of a dramatic Champions League group-stage exit after they fell to a 2-0 away defeat,sports
Super Eagles Stalwart Wilfred Ndidi Back from Injury,Leicester City manger Brendan Rodgers has expressed his excitement following the return of Super Eagles' holding midfielder Wilfred Ndidi from,sports
US Senators Question Apple and Google on App Store Dominance,A panel of US senators questioned officials from Apple Inc and Alphabet Inc's Google on Wednesday about the dominance of,tech
"Lewis Hamilton Wins Seventh F1 Title, Becomes Most Successful Driver Ever",Lewis Hamilton clinched a seventh World Championship and became the most successful racing driver ever with a masterful victory in,sports
"Nigeria: PDP NEC Sets Up 37-Man Committee Over Presidential Ticket, Sells Form for N35m",Nigeria's main opposition Peoples Democratic Party (PDP) has set up a 37-man committee to discuss issues around its presidential ticket,politics
Toshiba Targets $3bn Revenue in Quantum Cryptography by 2030,Toshiba Corp. said on Monday it aims to generate $3 billion in revenue from its advanced cryptographic technology for data,tech
ECOWAS Parliament Cautions Against Cryptocurrencies,"The meeting of the Joint Committee of the ECOWAS Parliament holding in Ouagadougou, Burkina Faso has cautioned against the use",business
WTA Suspends Tournaments in China over Peng Concerns,The Women's Tennis Association (WTA) on Wednesday announced the immediate suspension of all tournaments in China due to concerns about,sports
Nigeria: Governing APC Formally Informs INEC of February 26 Convention,The All Progressives Congress (APC) has written to the Independent National Electoral Commission (INEC) to officially communicate its plan to,politics
Nigeria: Low Turnout in Several States as First Phase of Covid Vaccination Ends April 16,"As the target date given by the federal government for states to end the first phase of Covid-19 vaccination approaches,",health
Tokyo Olympics: US Beat France 87-82 to Claim Fourth Straight Gold Medal in Men's Basketball,Tokyo Olympics: US Beat France 87-82 to Claim Fourth Straight Gold Medal in Men's Basketball Team USA secured a fourth,sports
Simone Biles will not defend her Olympic gold medal on floor exercise.,"USA Gymnastics announced Sunday that the six-time Olympic medalist has opted not to compete on floor, where she won gold",health
Buzzfeed Acquires HuffPost from Verizon Wireless,"HuffPost has a new owner, with its current parent company Verizon Media reaching an agreement to sell the site to",business
Nicole Young Wants Dr Dre Questioned on Alleged Mistresses,Dr Dre's estranged wife Nicole Young has asked a court to investigate his alleged mistresses. Young wants the court to,entertainment
"Pinnick Decries Campaign of Calumny, Says He Holds President Buhari in High Esteem","President of the Nigeria Football Federation, Mr Amaju Melvin Pinnick on Tuesday expressed shock at a report in a section",sports
Bank of Japan Governor Optimistic Economy Will Recover,"Bank of Japan Governor Haruhiko Kuroda expressed optimism Thursday about the country's economic recovery amid the coronavirus pandemic. ""Economic activity",business
Valieva to Take to Olympic Ice Once More on Thursday Amid Doping Scandal,"Kamila Valieva aims for the top step of a podium she may never see when the Russian figure skating star,",sports
WHO Says 7m Doses of Covid Vaccines Administered in Africa So Far,"Over six million doses of the COVID-19 vaccine have been administered in Africa, a World Health Organization (WHO) official has",health
Carney Chukwuemeka: Chelsea Sign Aston Villa Midfielder For £20m,", who starred in England's Under-19 European Championship triumph in July, has agreed a six-year deal.Read more",sports
Brent Crude Oil Hits $120 as EU Meets on Russia Sanctions,"Oil prices climbed above $120 a barrel on Monday, hitting their highest in more than two months as traders priced",business
"Obasanjo Visits Benin President, Seeks Soft Landing for Yoruba Nation Agitator Igboho","Former President Olusegun Obasanjo held a meeting with President of Benin Republic, Patrice Talon in the first week of August",politics
"Continued Stay of Service Chiefs a Huge Problem for Nigeria, Says Ahmed Buhari",A former Nigerian presidential candidate Ahmed Buhari has said the continued stay of the country's service chiefs poses a huge,politics
South Africa Wants More Men to Take Covid Jabs,South Africa has urged more men in the country to come out in larger numbers and take Covid jabs as,health
"Don't Wait for Tomorrow to Take over Power from Corrupt Leaders, Obasanjo Tells Nigerian Youths","ÄúMy advice for Nigerian youths is that never let anybody tell you that you are the leaders of tomorrow.""Read more",politics
Philippines' Duterte Says Daughter Running for President in 2022 Elections,"Philippine President Rodrigo's daughter would run for president in next year's election and her father's long-time aide, who filed his",politics
"Chinese Vaccines Sweep Much of the World, Despite Western Concerns","The plane laden with vaccines had just rolled to a stop at Santiago's airport in late January, and Chile's president,",health
Will Smith Wins Best Actor at Oscars for King Richard after Slapping Chris Rock,Will Smith on Sunday won the Oscar for best actor for portraying Venus and Serena Williams' father Richard in the,entertainment
Germany-France Heavyweight Clash Set to Light Up Euro 2020,"France vs Germany is one of the most anticipated matchups of the Euro 2020 group stage, and it could well",sports
Tesla's Musk Says He Will Pay Over $11bn in Tax this Year,Electric-car maker Tesla Inc's Chief Executive Officer Elon Musk said on Sunday on Twitter that he will pay more than,business
Kanye West Sneakers Fetch Record $1.8M at Private Sale,A pair of prototype Nikes worn by Kanye West during a performance at the Grammy Awards in 2008 has shattered,entertainment
"AFCON 2021: Nigeria to Play Egypt, Holders Algeria Face Ivory Coast","Nigeria's Super Eagles have been drawn in a group alongside Africa's most successful side, Egypt in the group stage for",sports
Nigeria: Purported Endorsement of Consensus Chairman Divides APC Governors,"The purported endorsement of a former Governor of Nasarawa State, Senator Abdullahi Adamu, as the consensus National Chairman of the",politics
Trump 'Planning to Declare Victory if it Looks Like He's Ahead' in Tuesday's Election,US President Donald Trump has told people close to him that he will declare victory on Tuesday night if he,politics
Nigeria's Super Falcons Land in America for Summer Series,Nine Äìtime African champions Nigeria have arrived in the United States of America for this year's Summer Series Äì a,sports
The Milkmaid' is Nigeria's Official Submission for 2021 Oscars,The Nigerian Oscars Selection Committee has selected†Desmond Ovbiagele's†'The Milkmaid'†as Nigeria's submission to the International Feature Film category of the 2021,entertainment
Only God Will Take Me Out of Brasilia': Defiant Bolsonaro Talks Tough,Hundreds of thousands of Brazilians rallied across the country on Tuesday in support of far-right populist President Jair Bolsonaro and,politics
Olympic Village Confirms First Covid Case Days Before Tokyo Games,"The Tokyo Olympics has registered its first Covid-19 case in the Olympic Village six days before the Games open, the",sports
US Attorney General Barr Resigns,"Attorney General William Barr, one of President Donald Trump's staunchest allies, is departing amid lingering tension over the president's baseless",politics
"Nigeria: Central Bank Chief, Comms Minister Settle Banks, MTN's Dispute over Commission",Emma Okonji Four days after commercial banks disconnected customers of MTN Nigeria from the use of the Unstructured Supplementary Service,business
"Nigeria: NDLEA, DSS Seal Off Abuja Hotel to 'Stop Launch of New Psychoactive Drink'",A joint team of National Drug Law Enforcement Agency (NDLEA) and Department of State Services (DSS) have raided and sealed,health
"Igbo Committed to Nigeria's Unity But Most†Vulnerable in Terms of Insecurity, Ohanaeze Says",Ohaneze†Ndigbo Worldwide has†reemphasised the commitment of†citizens of Igbo extraction†to a united and prosperous Nigeria but noted that†the story of insecurity,politics
"In a Dramatic Shift, Former SGF Kingibe Says Nigeria's Unity Negotiable","Contrary to the claims by many Nigerian leaders that the unity of the country is non-negotiable, a former Secretary to",politics
Ford To Convert British Factory into Electric Vehicle Plant with $315m,US motor giant Ford has announced on Monday that it intends to spend £230 million ($315 million) transforming a factory,business
Nigeria Orders Reactivation  of  Covid Isolation Centres Nationwide,Nigeria's federal government has directed all Covid-19 Isolation Centres across the country to immediately activate their facilities in anticipation of,health
Klopp Laments Penalty Chances after Shock Defeat at Southampton,"Liverpool's manager, Jurgen Klopp, has insisted that it was baffling that the Premier League champions were not awarded a penalty",sports
"Peugeot Forecasts Nigeria to Import $7.5bn Worth of Used Vehicles, Motorcycles in 2021","The Chairman of Peugeot Automobile Nigeria (PAN) and former member of the House of Representatives, Hon. Ahmed Wadada Aliyu, tuesday",business
"Running Mate: Tinubu Working on Options, Okowa, Wike Top PDP's List, Obi, Kwankwaso Still Consulting","With deadline for the submission of names of presidential candidates and their running mates three days away, the leaderships of",politics
Former Republicans and Democrats Form New Third US Political Party,"The new party called Forward will be co-chaired by former Democratic presidential candidate Andrew Yang and Christine Todd Whitman, the",politics
Amazon to Begin Drone Deliveries in California This Year,"Amazon says it will begin delivering parcels to shoppers by drone for the first time later this year, pending final",business
"Nigeria: Tension High, Don't Heat Polity Further, Ex-Sokoto Governor Bafawara Cautions Politicians","A former Governor of Nigeria's northwestern Sokoto State, Attahiru Bafarawa, has called on politicians and political commentators across the country",politics
"Getting Covid-19 Vaccine is of Utmost Concern to Nigeria, Says VP Osinbajo",Nigeria's Vice-President Prof. Yemi Osinbajo has said getting the Covid-19 vaccine is a matter of utmost concern for the country.,health
"OPEC Mandates Nigeria to Cut Production by 939,000bpd in Three Months","The Organisation of Petroleum Exporting Countries (OPEC) on Tuesday upheld its December 3, 2020 decision to increase crude oil production",business
Nigeria: Flour Mills Acquires Majority Stake in Honeywell Flour Mills For N80bn,"Nigeria's biggest flour maker, Flour Mills has announced an agreement to acquire Honeywell Group's portfolio company, Honeywell Flour Mills PLC",business
All Set for Zenith Bank's 7th Annual International Trade Seminar on Non-Oil Export,"The seminar will draw participation from trade practitioners, local and foreign exporters, manufacturers, financial institutions, and government agencies.Read more",business
Mauritius to Have Presence in Space as Satellite Set for Launch,Mauritius is set to have a presence in space following the planned launch of a small satellite onboard a rocket,tech
DMX Posthumous Album Due for Release May 28,"A new album by the late rapper DMX,†who died in April, will be released later this month. Featuring new material",entertainment
Nigeria: Court Restrains Buni from Parading Himself as APC Interim Chairman,A High Court sitting in Asaba on Wednesday restrained Governor Mai Mala Buni of Yobe State and other members of,politics
"Okupe Withdraws as Peter Obi's Running Mate, Paves Way for Substantive VP Candidate","Former presidential aide, Doyin Okupe, has withdrawn from his position as running mate to the presidential candidate of the Labour",politics
Twitter Stock Soars As Tesla CEO Elon Musk Reveals 9.2% Stake,"Tesla Inc Chief Executive Officer Elon Musk has built a 9.2% stake in Twitter Inc, a regulatory filing showed on",tech
Niger State Governor Tests Positive to COVID-19,"Governor of Niger state in north-central Nigeria, Abubakar Sani Bello, has announced that he has tested positive to COVID-19. The",health
Nigeria: EFCC Arrests Ex-Imo Governor Okorocha,"The Economic and Financial Crimes Commission (EFCC) on Tuesday arrested a former Governor of Imo State, Senator Rochas Okorocha, in",politics
"Anthony Joshua v Tyson Fury Might Not Happen Until 2023, Steve Bunce Fears","The world heavyweight title showdown between Anthony Joshua and Tyson Fury might not happen until at least 2023, fears BBC",sports
UK Doctors Seek Review of 12-week Gap Between Vaccine Doses,A major British doctors' group says the UK government should Äúurgently reviewÄù its decision to give people a second dose,health
"Nigeria: My Meeting with Tinubu Not About Presidency, Governors' Chairman Fayemi Says","Governor of Ekiti State, Dr Kayode Fayemi, has clarified that his recent meeting with the former Governor of Lagos State,",politics
Covid-19: Court Orders Reopening of Popular Abuja Markets,"A Nigerian court has ordered the reopening of popular Wuse, UTC markets and Murg Shopping Plaza shut down on Monday",health
"About 3,000 on Singapore Cruise Ship Confined to Cabins after Suspected Covid Case",A Genting Cruise Lines' ship on a Äúcruise to nowhereÄù has returned to Singapore after a passenger was suspected of,health
Nigeria Reach Qatar 2022 Final Qualifiers after Draw with Cape Verde,Three Äìtime African champions Nigeria survived an intense dogfight against Cape Verde in Lagos on Tuesday to qualify for the,sports
"Single-Shot Johnson & Johnson Vaccine Safe, US Regulators Say",A review by US regulators of the single-shot Johnson & Johnson coronavirus vaccine has found it is safe and effective.,health
GAGE Awards Announces Panel of Judges as Nominations Come to a Close,"Months of deliberation has secured a superb lineup of Nigeria's industry key figures, a fitting panel to consider, discuss and",tech
NNPC-Sahara JV Mulls Jetty Construction Across West Africa to Boost LPG Supply,"WAGL Energy Limited, a joint venture business operated by the Nigerian National Petroleum Company (NNPC) Limited and Sahara Group, has",business
Stanbic IBTC Reels out PMI number for Some African Economies,The Stanbic IBTC Bank Nigeria Purchasing Managers Index edged down to 50.7 in January of 2021 from 51.8 in the,business
"Nigeria: Only God Can Take My Life, Says APC Leader Tinubu","National leader of Nigeria's governing political party, the All Progressives Congress (APC), Senator Bola Tinubu, on Sunday, said only God,",politics
Nigeria: APC May Annul Last Week's Ward Congresses,"All things being equal, the leadership of the All Progressives Congress (APC) is likely to annul its ward congresses held",politics
Oil Prices Head for $100 as Bonny Light Sells for $95,"Oil prices continued their surge on Saturday, sending one of Nigeria's most valued grades, Bonny Light to $95 and Algeria's",business
"Nigeria: Federalism, LG Autonomy Top Demands at Constitution Review Hearings","The clamour for federalism, local government autonomy, community policing and devolution of power dominated the nationwide public hearings conducted Tuesday",politics
Barcelona Postpone Presidential Election Due to Covid-19,"The Catalan giants will not be putting a new board of directors in place any time soon, with plans at",sports
Tesla Starts Delivery of Shanghai-made Model Y SUVs in China,Tesla Inc said on Monday it has started delivering its Shanghai-made Model Y sports utility vehicles to customers in China.,tech
Premier League: Wolves Rise to Sixth after Beating Leeds,"Wolves' Win at Leeds United, which moved them into sixth in the Premier League, was a ""massive result"" according to",sports
AngloGold Ashanti Appoints Ramos as New Chairwoman,"AngloGold Ashanti Ltd. has appointed Maria Ramos as chairwoman to replace Sipho Pityana, who resigned almost three months after Chief",business
"Nigeria: INEC Reacts to Election Guidelines Adjustment, Says It's Not Unilateral, Explains PDP is First Beneficiary","In its first official reaction to the adjustment of the general election guidelines, the Independent National Electoral Commission (INEC), on",politics
Imo State Says Attack on Governor Uzodinma's House Politically Motivated,Imo State Government says preliminary investigation into the attack on the country home of Governor Hope Uzodinma suggests it may,politics
Nigeria Gets $3.35bn in IMF's Historic $650bn SDR Allocation,The Board of Governors of the International Monetary Fund (IMF) has approved a general allocation of Special Drawing Rights (SDRs),business
"Nigeria: In Plot to Retake Power in 2023, PDP Shows Strong Cohesion at National Convention","Ä¢Prospects of southern presidential candidate brighten as Ayu emerges national chair Ä¢Party inaugurates new NWC members December 9 Ä¢Atiku, Tambuwal,†Saraki's",politics
Fitch Revises Nigeria's 2021 GDP Growth Forecast to 1.6% from 2.3%,"Fitch Ratings has revised downward its 2021 growth forecast for Nigeria to 1.6 per cent, from its previous expectation of",business
Militant Attack Kills at Least 40 in Niger,"No less than 40 people have been killed in suspected militant attacks in Niger's western Tahoua region on Sunday, hours",politics
Major Outage at Amazon Disrupts Businesses across the US,A major outage in Amazon's cloud computing network Tuesday severely disrupted services at a wide range of U.S. companies for,business
Super Eagles Come From Behind to Beat Sierra Leone 2-1 in AFCON Qualifier,Nigeria overcame a stunning early goal to turn the screw on Sierra Leone and eventually win 2-1 to pick all,sports
Olivia Newton-John Dead at 73,"Olivia Newton-John died ""peacefully at her Ranch in Southern California this morning, surrounded by family and friends,"" according to an",entertainment
Brazil to Play Spain for Olympic Gold Medal in Men's Football,Defending champion Brazil will face Spain for the Olympic gold medal in men's football on Saturday. Spain beat host Japan,sports
"Nigeria: FG Turned Down Governors' Request to Borrow N50bn from Central Bank, Finance Minister Ahmed Says","Nigeria's Minister of Finance, Budget and National Planning, Mrs. Zainab Ahmed, on Monday narrated how the federal government rejected a",politics
Christian Association Demands Return of Nigeria to 'True Secular State',The Christian Association of Nigeria (CAN) has asked the National Assembly to ensure the removal of sections of the constitution,politics
German Auto Giants Place Their Bets on Hydrogen Cars,"Battery power may be the frontrunner to become the car technology of the future, but don't rule out the underdog",business
The Weeknd to Headline NFL Super Bowl Halftime Show,"Canadian popstar The Weeknd has been announced as the headline performer at next year's Super Bowl. The Grammy award-winning singer,",entertainment
Pfizer Slashed Its Original Covid-19 Vaccine Rollout Target After Supply Chain Obstacles,When Pfizer Inc. said last month it expects to ship half the Covid-19 vaccines it had originally planned for this,health
OPEC: Nigeria's Production Underperformance Hit 2.4m Barrels in December,"With a daily underperformance figure of 78,000 barrels per day in December, Nigeria lost as much as 2.418 million barrels",business
